{
  "$schema": "http://json-schema.org/draft-07/schema#",
  "title": "Phase Summary Artifact",
  "type": "object",
  "additionalProperties": false,
  "required": ["schema_version", "artifact_type", "lifecycle", "producer_role", "phase", "generated_at", "derived_from", "chunks"],
  "properties": {
    "schema_version": { "const": "1" },
    "artifact_type": { "const": "phase_summary" },
    "lifecycle": { "enum": ["active", "superseded", "final"] },
    "producer_role": { "const": "CONDUCTOR" },
    "phase": { "type": "integer" },
    "generated_at": { "type": "string" },
    "derived_from": {
      "type": "array",
      "minItems": 1,
      "items": {
        "type": "object",
        "additionalProperties": false,
        "required": ["artifact_path", "content_sha256", "head_sha", "generated_at"],
        "properties": {
          "artifact_path": { "type": "string", "description": "the lower-level artifact this was derived from" },
          "content_sha256": {
            "type": "string",
            "pattern": "^[0-9a-f]{64}$",
            "description": "hash of that artifact's on-disk content; a summary whose stored hash no longer matches the file on disk is STALE"
          },
          "head_sha": { "type": "string", "pattern": "^[0-9a-f]{40}$" },
          "generated_at": { "type": "string" },
          "lifecycle": { "type": "string", "description": "the lower artifact's lifecycle at derive time" },
          "base_fresh": { "type": "boolean", "description": "result of an artifact-fresh check at derive time" }
        }
      }
    },
    "chunks": {
      "type": "array",
      "items": {
        "type": "object",
        "additionalProperties": false,
        "required": ["issue", "state", "evidence_artifact", "evidence_head_sha", "branch", "worktree_path"],
        "properties": {
          "issue": { "type": "integer" },
          "state": { "enum": ["dispatched", "in_progress", "blocked", "verified", "merged"] },
          "evidence_artifact": { "type": "string", "description": "path to the pr_draft/blocker/review/verify artifact backing this state" },
          "evidence_head_sha": {
            "type": "string",
            "pattern": "^[0-9a-f]{40}$",
            "description": "MUST equal branch HEAD for a 'verified' claim to be valid — enforced by readers"
          },
          "branch": { "type": "string" },
          "worktree_path": { "type": "string" },
          "note": { "type": "string" }
        }
      }
    }
  }
}
