{
  "schema_version": "1",
  "artifact_type": "phase_summary",
  "lifecycle": "active",
  "producer_role": "CONDUCTOR",
  "phase": 2,
  "generated_at": "2026-05-23T14:30:00Z",
  "derived_from": [
    {
      "artifact_path": ".review/ISSUE-31-PR-DRAFT.json",
      "content_sha256": "9f86d081884c7d659a2feaa0c55ad015a3bf4f1b2b0b822cd15d6c15b0f00a08",
      "head_sha": "e86c685a1b2c3d4e5f60718293a4b5c6d7e8f901",
      "generated_at": "2026-05-23T14:25:00Z",
      "lifecycle": "active",
      "base_fresh": true
    }
  ],
  "chunks": [
    {
      "issue": 31,
      "state": "verified",
      "evidence_artifact": ".review/ISSUE-31-PR-DRAFT.json",
      "evidence_head_sha": "e86c685a1b2c3d4e5f60718293a4b5c6d7e8f901",
      "branch": "feature/issue-31",
      "worktree_path": "/workspace/target-wt/issue-31",
      "note": "happy path GREEN end-to-end"
    },
    {
      "issue": 33,
      "state": "in_progress",
      "evidence_artifact": ".review/ISSUE-33-BLOCKER.json",
      "evidence_head_sha": "b8b6332c4d5e6f708192a3b4c5d6e7f809102132",
      "branch": "feature/issue-33",
      "worktree_path": "/workspace/target-wt/issue-33"
    }
  ]
}
